{
  "id": "0192f3a4-5b6c-7d8e-9f01-23456789abd0",
  "type": "xm.article.discovered.v1",
  "source": "edge/poller",
  "subject": "bb5b0dac3780d151312aecc7e0e79d904a30c7548dd1b24cf672c6ba3b789303",
  "time": "2026-09-13T10:00:00Z",
  "schema_version": 1,
  "idempotency_key": "76ac33736361be5c7d2a98d66315183acd09b6b54341d7afece886ed44f68a19",
  "caused_by": null,
  "data": {
    "article_id": "bb5b0dac3780d151312aecc7e0e79d904a30c7548dd1b24cf672c6ba3b789303",
    "url": "https://news.ycombinator.com/item?id=49688984",
    "canonical_url": "https://news.ycombinator.com/item?id=49688984",
    "source_id": "hn-comments",
    "discovered_at": "2026-09-13T10:00:00Z",
    "published_at": "2026-09-12T21:30:00Z",
    "feed_title": "Comment on: Ask HN: How do you evaluate RAG pipelines in production?",
    "feed_summary": "We keep struggling with this. Our retrieval evals pass offline but answers regress silently after every index rebuild, and there is no tool that tells us which chunk changed.",
    "signals": {
      "hn_item_id": null,
      "hn_points": null,
      "hn_comments": null,
      "observed_at": null
    },
    "doc_kind": "discussion",
    "discussion": {
      "platform": "hn",
      "thread_url": "https://news.ycombinator.com/item?id=49688861",
      "parent_url": "https://news.ycombinator.com/item?id=49688861",
      "author_hash": "43bf635a7899e460efceb4649a7052d965337a99cff65082c5421562a2cf1498",
      "engagement": {
        "points": null,
        "comments": 4,
        "reactions": null
      }
    }
  }
}
