{
  "id": "0192f3a4-5b6c-7d8e-9f01-23456789abcd",
  "type": "xm.article.discovered.v1",
  "source": "edge/poller",
  "subject": "b6057b134e61b96fde7799b648e05b79f840502ca05565d16ee82c44f16ba490",
  "time": "2026-09-13T10:00:00Z",
  "schema_version": 1,
  "idempotency_key": "2b897fd38e8734c35135ff9645a3946838ab4f49270af6da1341eaf4d49b9852",
  "caused_by": null,
  "data": {
    "article_id": "b6057b134e61b96fde7799b648e05b79f840502ca05565d16ee82c44f16ba490",
    "url": "https://www.anthropic.com/news/claude-example?utm_source=rss",
    "canonical_url": "https://anthropic.com/news/claude-example",
    "source_id": "anthropic-news",
    "discovered_at": "2026-09-13T10:00:00Z",
    "published_at": "2026-09-13T09:30:00Z",
    "feed_title": "Introducing a Claude example",
    "feed_summary": "An example announcement used as a contract fixture.",
    "signals": {
      "hn_item_id": null,
      "hn_points": null,
      "hn_comments": null,
      "observed_at": null
    },
    "doc_kind": "article",
    "discussion": null
  }
}
